[
  {
    "rule_id": "TANK_2106.0",
    "description": "延炼脱氢液罐2106.0参数：volume=3000.0m3；level_max=13.76m；level_min=1.65m；diameter=16.66120736735455m；initial_level=7.705m；meter_factor=182.0t/m；density=0.8347733333333334t/m3。",
    "sets": [
      {
        "set_name": "X",
        "subset_name": null,
        "element": "2106.0"
      }
    ],
    "parameters": {
      "volume": {
        "value": 3000.0,
        "unit": "m3"
      },
      "level_max": {
        "value": 13.76,
        "unit": "m"
      },
      "level_min": {
        "value": 1.65,
        "unit": "m"
      },
      "diameter": {
        "value": 16.66120736735455,
        "unit": "m"
      },
      "initial_level": {
        "value": 7.705,
        "unit": "m"
      },
      "meter_factor": {
        "value": 182.0,
        "unit": "t/m"
      },
      "density": {
        "value": 0.8347733333333334,
        "unit": "t/m3"
      }
    }
  }
]
