[
  {
    "rule_id": "TANK_T-4801",
    "description": "延石化甲醇罐T-4801参数：volume=2000.0m3；level_max=12.56m；level_min=2.5m；diameter=14.0m。",
    "sets": [
      {
        "set_name": "X",
        "subset_name": null,
        "element": "T-4801"
      }
    ],
    "parameters": {
      "volume": {
        "value": 2000.0,
        "unit": "m3"
      },
      "level_max": {
        "value": 12.56,
        "unit": "m"
      },
      "level_min": {
        "value": 2.5,
        "unit": "m"
      },
      "diameter": {
        "value": 14.0,
        "unit": "m"
      }
    }
  },
  {
    "rule_id": "TANK_T-4802",
    "description": "延石化甲醇罐T-4802参数：volume=2000.0m3；level_max=12.56m；level_min=2.5m；diameter=14.0m。",
    "sets": [
      {
        "set_name": "X",
        "subset_name": null,
        "element": "T-4802"
      }
    ],
    "parameters": {
      "volume": {
        "value": 2000.0,
        "unit": "m3"
      },
      "level_max": {
        "value": 12.56,
        "unit": "m"
      },
      "level_min": {
        "value": 2.5,
        "unit": "m"
      },
      "diameter": {
        "value": 14.0,
        "unit": "m"
      }
    }
  },
  {
    "rule_id": "TANK_T-41005",
    "description": "延石化甲醇罐T-41005参数：volume=2000.0m3；level_max=13.5m。",
    "sets": [
      {
        "set_name": "X",
        "subset_name": null,
        "element": "T-41005"
      }
    ],
    "parameters": {
      "volume": {
        "value": 2000.0,
        "unit": "m3"
      },
      "level_max": {
        "value": 13.5,
        "unit": "m"
      }
    }
  },
  {
    "rule_id": "TANK_T-41006",
    "description": "延石化甲醇罐T-41006参数：volume=2000.0m3；level_max=13.5m。",
    "sets": [
      {
        "set_name": "X",
        "subset_name": null,
        "element": "T-41006"
      }
    ],
    "parameters": {
      "volume": {
        "value": 2000.0,
        "unit": "m3"
      },
      "level_max": {
        "value": 13.5,
        "unit": "m"
      }
    }
  }
]
