[
  {
    "rule_id": "BLEND_RECIPE_MIN_92_GASOLINE_CAT_GASOLINE",
    "description": "92#汽油中催化汽油配方比例下限为0.3。",
    "sets": [
      {
        "set_name": "IU",
        "subset_name": null,
        "element": "92#汽油调合.催化汽油"
      },
      {
        "set_name": "OU",
        "subset_name": null,
        "element": "92#汽油调合.92#汽油"
      }
    ],
    "parameters": {
      "component_mass_fraction_min": {
        "value": 0.3,
        "unit": "1"
      }
    }
  },
  {
    "rule_id": "BLEND_RECIPE_MAX_92_GASOLINE_CAT_GASOLINE",
    "description": "92#汽油中催化汽油配方比例上限为0.6。",
    "sets": [
      {
        "set_name": "IU",
        "subset_name": null,
        "element": "92#汽油调合.催化汽油"
      },
      {
        "set_name": "OU",
        "subset_name": null,
        "element": "92#汽油调合.92#汽油"
      }
    ],
    "parameters": {
      "component_mass_fraction_max": {
        "value": 0.6,
        "unit": "1"
      }
    }
  },
  {
    "rule_id": "BLEND_RECIPE_MIN_92_GASOLINE_CDU_NAPHTHA",
    "description": "92#汽油中常压石脑油配方比例下限为0.0。",
    "sets": [
      {
        "set_name": "IU",
        "subset_name": null,
        "element": "92#汽油调合.常压石脑油"
      },
      {
        "set_name": "OU",
        "subset_name": null,
        "element": "92#汽油调合.92#汽油"
      }
    ],
    "parameters": {
      "component_mass_fraction_min": {
        "value": 0.0,
        "unit": "1"
      }
    }
  },
  {
    "rule_id": "BLEND_RECIPE_MAX_92_GASOLINE_CDU_NAPHTHA",
    "description": "92#汽油中常压石脑油配方比例上限为0.1。",
    "sets": [
      {
        "set_name": "IU",
        "subset_name": null,
        "element": "92#汽油调合.常压石脑油"
      },
      {
        "set_name": "OU",
        "subset_name": null,
        "element": "92#汽油调合.92#汽油"
      }
    ],
    "parameters": {
      "component_mass_fraction_max": {
        "value": 0.1,
        "unit": "1"
      }
    }
  },
  {
    "rule_id": "BLEND_RECIPE_MIN_92_GASOLINE_MTBE",
    "description": "92#汽油中MTBE配方比例下限为0.0。",
    "sets": [
      {
        "set_name": "IU",
        "subset_name": null,
        "element": "92#汽油调合.MTBE"
      },
      {
        "set_name": "OU",
        "subset_name": null,
        "element": "92#汽油调合.92#汽油"
      }
    ],
    "parameters": {
      "component_mass_fraction_min": {
        "value": 0.0,
        "unit": "1"
      }
    }
  },
  {
    "rule_id": "BLEND_RECIPE_MAX_92_GASOLINE_MTBE",
    "description": "92#汽油中MTBE配方比例上限为0.15。",
    "sets": [
      {
        "set_name": "IU",
        "subset_name": null,
        "element": "92#汽油调合.MTBE"
      },
      {
        "set_name": "OU",
        "subset_name": null,
        "element": "92#汽油调合.92#汽油"
      }
    ],
    "parameters": {
      "component_mass_fraction_max": {
        "value": 0.15,
        "unit": "1"
      }
    }
  },
  {
    "rule_id": "BLEND_RECIPE_MIN_92_GASOLINE_ALKYLATE",
    "description": "92#汽油中烃化液配方比例下限为0.0。",
    "sets": [
      {
        "set_name": "IU",
        "subset_name": null,
        "element": "92#汽油调合.烃化液"
      },
      {
        "set_name": "OU",
        "subset_name": null,
        "element": "92#汽油调合.92#汽油"
      }
    ],
    "parameters": {
      "component_mass_fraction_min": {
        "value": 0.0,
        "unit": "1"
      }
    }
  },
  {
    "rule_id": "BLEND_RECIPE_MAX_92_GASOLINE_ALKYLATE",
    "description": "92#汽油中烃化液配方比例上限为0.3。",
    "sets": [
      {
        "set_name": "IU",
        "subset_name": null,
        "element": "92#汽油调合.烃化液"
      },
      {
        "set_name": "OU",
        "subset_name": null,
        "element": "92#汽油调合.92#汽油"
      }
    ],
    "parameters": {
      "component_mass_fraction_max": {
        "value": 0.3,
        "unit": "1"
      }
    }
  },
  {
    "rule_id": "BLEND_RECIPE_MIN_95_GASOLINE_CAT_GASOLINE",
    "description": "95#汽油中催化汽油配方比例下限为0.3。",
    "sets": [
      {
        "set_name": "IU",
        "subset_name": null,
        "element": "95#汽油调合.催化汽油"
      },
      {
        "set_name": "OU",
        "subset_name": null,
        "element": "95#汽油调合.95#汽油"
      }
    ],
    "parameters": {
      "component_mass_fraction_min": {
        "value": 0.3,
        "unit": "1"
      }
    }
  },
  {
    "rule_id": "BLEND_RECIPE_MAX_95_GASOLINE_CAT_GASOLINE",
    "description": "95#汽油中催化汽油配方比例上限为0.55。",
    "sets": [
      {
        "set_name": "IU",
        "subset_name": null,
        "element": "95#汽油调合.催化汽油"
      },
      {
        "set_name": "OU",
        "subset_name": null,
        "element": "95#汽油调合.95#汽油"
      }
    ],
    "parameters": {
      "component_mass_fraction_max": {
        "value": 0.55,
        "unit": "1"
      }
    }
  },
  {
    "rule_id": "BLEND_RECIPE_MIN_95_GASOLINE_CDU_NAPHTHA",
    "description": "95#汽油中常压石脑油配方比例下限为0.0。",
    "sets": [
      {
        "set_name": "IU",
        "subset_name": null,
        "element": "95#汽油调合.常压石脑油"
      },
      {
        "set_name": "OU",
        "subset_name": null,
        "element": "95#汽油调合.95#汽油"
      }
    ],
    "parameters": {
      "component_mass_fraction_min": {
        "value": 0.0,
        "unit": "1"
      }
    }
  },
  {
    "rule_id": "BLEND_RECIPE_MAX_95_GASOLINE_CDU_NAPHTHA",
    "description": "95#汽油中常压石脑油配方比例上限为0.05。",
    "sets": [
      {
        "set_name": "IU",
        "subset_name": null,
        "element": "95#汽油调合.常压石脑油"
      },
      {
        "set_name": "OU",
        "subset_name": null,
        "element": "95#汽油调合.95#汽油"
      }
    ],
    "parameters": {
      "component_mass_fraction_max": {
        "value": 0.05,
        "unit": "1"
      }
    }
  },
  {
    "rule_id": "BLEND_RECIPE_MIN_95_GASOLINE_MTBE",
    "description": "95#汽油中MTBE配方比例下限为0.0。",
    "sets": [
      {
        "set_name": "IU",
        "subset_name": null,
        "element": "95#汽油调合.MTBE"
      },
      {
        "set_name": "OU",
        "subset_name": null,
        "element": "95#汽油调合.95#汽油"
      }
    ],
    "parameters": {
      "component_mass_fraction_min": {
        "value": 0.0,
        "unit": "1"
      }
    }
  },
  {
    "rule_id": "BLEND_RECIPE_MAX_95_GASOLINE_MTBE",
    "description": "95#汽油中MTBE配方比例上限为0.15。",
    "sets": [
      {
        "set_name": "IU",
        "subset_name": null,
        "element": "95#汽油调合.MTBE"
      },
      {
        "set_name": "OU",
        "subset_name": null,
        "element": "95#汽油调合.95#汽油"
      }
    ],
    "parameters": {
      "component_mass_fraction_max": {
        "value": 0.15,
        "unit": "1"
      }
    }
  },
  {
    "rule_id": "BLEND_RECIPE_MIN_95_GASOLINE_ALKYLATE",
    "description": "95#汽油中烃化液配方比例下限为0.0。",
    "sets": [
      {
        "set_name": "IU",
        "subset_name": null,
        "element": "95#汽油调合.烃化液"
      },
      {
        "set_name": "OU",
        "subset_name": null,
        "element": "95#汽油调合.95#汽油"
      }
    ],
    "parameters": {
      "component_mass_fraction_min": {
        "value": 0.0,
        "unit": "1"
      }
    }
  },
  {
    "rule_id": "BLEND_RECIPE_MAX_95_GASOLINE_ALKYLATE",
    "description": "95#汽油中烃化液配方比例上限为0.35。",
    "sets": [
      {
        "set_name": "IU",
        "subset_name": null,
        "element": "95#汽油调合.烃化液"
      },
      {
        "set_name": "OU",
        "subset_name": null,
        "element": "95#汽油调合.95#汽油"
      }
    ],
    "parameters": {
      "component_mass_fraction_max": {
        "value": 0.35,
        "unit": "1"
      }
    }
  },
  {
    "rule_id": "BLEND_RECIPE_MIN_0_DIESEL_CAT_DIESEL",
    "description": "0#柴油中催化柴油配方比例下限为0.0。",
    "sets": [
      {
        "set_name": "IU",
        "subset_name": null,
        "element": "0#柴油调合.催化柴油"
      },
      {
        "set_name": "OU",
        "subset_name": null,
        "element": "0#柴油调合.0#柴油"
      }
    ],
    "parameters": {
      "component_mass_fraction_min": {
        "value": 0.0,
        "unit": "1"
      }
    }
  },
  {
    "rule_id": "BLEND_RECIPE_MAX_0_DIESEL_CAT_DIESEL",
    "description": "0#柴油中催化柴油配方比例上限为0.23。",
    "sets": [
      {
        "set_name": "IU",
        "subset_name": null,
        "element": "0#柴油调合.催化柴油"
      },
      {
        "set_name": "OU",
        "subset_name": null,
        "element": "0#柴油调合.0#柴油"
      }
    ],
    "parameters": {
      "component_mass_fraction_max": {
        "value": 0.23,
        "unit": "1"
      }
    }
  },
  {
    "rule_id": "BLEND_RECIPE_MIN_0_DIESEL_CDU_DIESEL",
    "description": "0#柴油中常压直馏柴油配方比例下限为0.77。",
    "sets": [
      {
        "set_name": "IU",
        "subset_name": null,
        "element": "0#柴油调合.常压直馏柴油"
      },
      {
        "set_name": "OU",
        "subset_name": null,
        "element": "0#柴油调合.0#柴油"
      }
    ],
    "parameters": {
      "component_mass_fraction_min": {
        "value": 0.77,
        "unit": "1"
      }
    }
  },
  {
    "rule_id": "BLEND_RECIPE_MAX_0_DIESEL_CDU_DIESEL",
    "description": "0#柴油中常压直馏柴油配方比例上限为1.0。",
    "sets": [
      {
        "set_name": "IU",
        "subset_name": null,
        "element": "0#柴油调合.常压直馏柴油"
      },
      {
        "set_name": "OU",
        "subset_name": null,
        "element": "0#柴油调合.0#柴油"
      }
    ],
    "parameters": {
      "component_mass_fraction_max": {
        "value": 1.0,
        "unit": "1"
      }
    }
  }
]