[
  {
    "rule_id": "TANK_23601.0",
    "description": "延炼1#渣油(备用)罐23601.0参数：volume=5000.0m3；level_max=15.18m；level_min=2.0m；diameter=20.0m；initial_level=8.59m；meter_factor=277.0t/m；density=0.8817183846139717t/m3；tank_height=17.82m。",
    "sets": [
      {
        "set_name": "X",
        "subset_name": null,
        "element": "23601.0"
      }
    ],
    "parameters": {
      "volume": {
        "value": 5000.0,
        "unit": "m3"
      },
      "level_max": {
        "value": 15.18,
        "unit": "m"
      },
      "level_min": {
        "value": 2.0,
        "unit": "m"
      },
      "diameter": {
        "value": 20.0,
        "unit": "m"
      },
      "initial_level": {
        "value": 8.59,
        "unit": "m"
      },
      "meter_factor": {
        "value": 277.0,
        "unit": "t/m"
      },
      "density": {
        "value": 0.8817183846139717,
        "unit": "t/m3"
      },
      "tank_height": {
        "value": 17.82,
        "unit": "m"
      }
    }
  }
]
