[
  {
    "rule_id": "TANK_T-4805",
    "description": "延石化MTBE罐T-4805参数：volume=2000.0m3；level_max=12.56m；level_min=2.5m；diameter=14.0m。",
    "sets": [
      {
        "set_name": "X",
        "subset_name": null,
        "element": "T-4805"
      }
    ],
    "parameters": {
      "volume": {
        "value": 2000.0,
        "unit": "m3"
      },
      "level_max": {
        "value": 12.56,
        "unit": "m"
      },
      "level_min": {
        "value": 2.5,
        "unit": "m"
      },
      "diameter": {
        "value": 14.0,
        "unit": "m"
      }
    }
  },
  {
    "rule_id": "TANK_T-4806",
    "description": "延石化MTBE罐T-4806参数：volume=2000.0m3；level_max=12.56m；level_min=2.5m；diameter=14.0m。",
    "sets": [
      {
        "set_name": "X",
        "subset_name": null,
        "element": "T-4806"
      }
    ],
    "parameters": {
      "volume": {
        "value": 2000.0,
        "unit": "m3"
      },
      "level_max": {
        "value": 12.56,
        "unit": "m"
      },
      "level_min": {
        "value": 2.5,
        "unit": "m"
      },
      "diameter": {
        "value": 14.0,
        "unit": "m"
      }
    }
  },
  {
    "rule_id": "TANK_T-41003",
    "description": "延石化MTBE罐T-41003参数：volume=3000.0m3；level_max=15.0m。",
    "sets": [
      {
        "set_name": "X",
        "subset_name": null,
        "element": "T-41003"
      }
    ],
    "parameters": {
      "volume": {
        "value": 3000.0,
        "unit": "m3"
      },
      "level_max": {
        "value": 15.0,
        "unit": "m"
      }
    }
  },
  {
    "rule_id": "TANK_T-41004",
    "description": "延石化MTBE罐T-41004参数：volume=3000.0m3；level_max=15.0m。",
    "sets": [
      {
        "set_name": "X",
        "subset_name": null,
        "element": "T-41004"
      }
    ],
    "parameters": {
      "volume": {
        "value": 3000.0,
        "unit": "m3"
      },
      "level_max": {
        "value": 15.0,
        "unit": "m"
      }
    }
  },
  {
    "rule_id": "TANK_24903.0",
    "description": "延炼MTBE罐24903.0参数：volume=1000.0m3；level_max=7.4m；level_min=2.5m；diameter=10.8m；initial_level=4.95m；meter_factor=68.0t/m；density=0.7422864285895577t/m3；tank_height=7.4m。",
    "sets": [
      {
        "set_name": "X",
        "subset_name": null,
        "element": "24903.0"
      }
    ],
    "parameters": {
      "volume": {
        "value": 1000.0,
        "unit": "m3"
      },
      "level_max": {
        "value": 7.4,
        "unit": "m"
      },
      "level_min": {
        "value": 2.5,
        "unit": "m"
      },
      "diameter": {
        "value": 10.8,
        "unit": "m"
      },
      "initial_level": {
        "value": 4.95,
        "unit": "m"
      },
      "meter_factor": {
        "value": 68.0,
        "unit": "t/m"
      },
      "density": {
        "value": 0.7422864285895577,
        "unit": "t/m3"
      },
      "tank_height": {
        "value": 7.4,
        "unit": "m"
      }
    }
  },
  {
    "rule_id": "TANK_24904.0",
    "description": "延炼MTBE罐24904.0参数：volume=1000.0m3；level_max=7.4m；level_min=2.5m；diameter=10.8m；initial_level=4.95m；meter_factor=68.0t/m；density=0.7422864285895577t/m3；tank_height=7.4m。",
    "sets": [
      {
        "set_name": "X",
        "subset_name": null,
        "element": "24904.0"
      }
    ],
    "parameters": {
      "volume": {
        "value": 1000.0,
        "unit": "m3"
      },
      "level_max": {
        "value": 7.4,
        "unit": "m"
      },
      "level_min": {
        "value": 2.5,
        "unit": "m"
      },
      "diameter": {
        "value": 10.8,
        "unit": "m"
      },
      "initial_level": {
        "value": 4.95,
        "unit": "m"
      },
      "meter_factor": {
        "value": 68.0,
        "unit": "t/m"
      },
      "density": {
        "value": 0.7422864285895577,
        "unit": "t/m3"
      },
      "tank_height": {
        "value": 7.4,
        "unit": "m"
      }
    }
  },
  {
    "rule_id": "TANK_24905.0",
    "description": "延炼MTBE罐24905.0参数：volume=1000.0m3；level_max=7.4m；level_min=2.5m；diameter=10.8m；initial_level=4.95m；meter_factor=81.0t/m；density=0.8841941281728555t/m3；tank_height=7.4m。",
    "sets": [
      {
        "set_name": "X",
        "subset_name": null,
        "element": "24905.0"
      }
    ],
    "parameters": {
      "volume": {
        "value": 1000.0,
        "unit": "m3"
      },
      "level_max": {
        "value": 7.4,
        "unit": "m"
      },
      "level_min": {
        "value": 2.5,
        "unit": "m"
      },
      "diameter": {
        "value": 10.8,
        "unit": "m"
      },
      "initial_level": {
        "value": 4.95,
        "unit": "m"
      },
      "meter_factor": {
        "value": 81.0,
        "unit": "t/m"
      },
      "density": {
        "value": 0.8841941281728555,
        "unit": "t/m3"
      },
      "tank_height": {
        "value": 7.4,
        "unit": "m"
      }
    }
  },
  {
    "rule_id": "TANK_9514.0",
    "description": "延炼MTBE罐9514.0参数：volume=5000.0m3；level_max=12.8m；level_min=2.5m；diameter=20.0m；initial_level=7.65m；meter_factor=232.5t/m；density=0.7400704852806802t/m3；tank_height=17.82m。",
    "sets": [
      {
        "set_name": "X",
        "subset_name": null,
        "element": "9514.0"
      }
    ],
    "parameters": {
      "volume": {
        "value": 5000.0,
        "unit": "m3"
      },
      "level_max": {
        "value": 12.8,
        "unit": "m"
      },
      "level_min": {
        "value": 2.5,
        "unit": "m"
      },
      "diameter": {
        "value": 20.0,
        "unit": "m"
      },
      "initial_level": {
        "value": 7.65,
        "unit": "m"
      },
      "meter_factor": {
        "value": 232.5,
        "unit": "t/m"
      },
      "density": {
        "value": 0.7400704852806802,
        "unit": "t/m3"
      },
      "tank_height": {
        "value": 17.82,
        "unit": "m"
      }
    }
  },
  {
    "rule_id": "TANK_9516.0",
    "description": "延炼MTBE罐9516.0参数：volume=5000.0m3；level_max=12.8m；level_min=2.5m；diameter=20.0m；initial_level=7.65m；meter_factor=224.0t/m；density=0.7130141449585908t/m3；tank_height=17.82m。",
    "sets": [
      {
        "set_name": "X",
        "subset_name": null,
        "element": "9516.0"
      }
    ],
    "parameters": {
      "volume": {
        "value": 5000.0,
        "unit": "m3"
      },
      "level_max": {
        "value": 12.8,
        "unit": "m"
      },
      "level_min": {
        "value": 2.5,
        "unit": "m"
      },
      "diameter": {
        "value": 20.0,
        "unit": "m"
      },
      "initial_level": {
        "value": 7.65,
        "unit": "m"
      },
      "meter_factor": {
        "value": 224.0,
        "unit": "t/m"
      },
      "density": {
        "value": 0.7130141449585908,
        "unit": "t/m3"
      },
      "tank_height": {
        "value": 17.82,
        "unit": "m"
      }
    }
  }
]
