[
  {
    "rule_id": "TANK_3002A",
    "description": "延炼醋酸仲丁酯罐3002A参数：volume=1000.0m3；level_max=8.8m；level_min=1.5m；diameter=12.3m；initial_level=5.15m；meter_factor=80.0t/m；density=0.6732709601792118t/m3；tank_height=12.3m。",
    "sets": [
      {
        "set_name": "X",
        "subset_name": null,
        "element": "3002A"
      }
    ],
    "parameters": {
      "volume": {
        "value": 1000.0,
        "unit": "m3"
      },
      "level_max": {
        "value": 8.8,
        "unit": "m"
      },
      "level_min": {
        "value": 1.5,
        "unit": "m"
      },
      "diameter": {
        "value": 12.3,
        "unit": "m"
      },
      "initial_level": {
        "value": 5.15,
        "unit": "m"
      },
      "meter_factor": {
        "value": 80.0,
        "unit": "t/m"
      },
      "density": {
        "value": 0.6732709601792118,
        "unit": "t/m3"
      },
      "tank_height": {
        "value": 12.3,
        "unit": "m"
      }
    }
  },
  {
    "rule_id": "TANK_3002B",
    "description": "延炼醋酸仲丁酯罐3002B参数：volume=1000.0m3；level_max=8.8m；level_min=1.5m；diameter=12.3m；initial_level=5.15m；meter_factor=80.0t/m；density=0.6732709601792118t/m3；tank_height=12.3m。",
    "sets": [
      {
        "set_name": "X",
        "subset_name": null,
        "element": "3002B"
      }
    ],
    "parameters": {
      "volume": {
        "value": 1000.0,
        "unit": "m3"
      },
      "level_max": {
        "value": 8.8,
        "unit": "m"
      },
      "level_min": {
        "value": 1.5,
        "unit": "m"
      },
      "diameter": {
        "value": 12.3,
        "unit": "m"
      },
      "initial_level": {
        "value": 5.15,
        "unit": "m"
      },
      "meter_factor": {
        "value": 80.0,
        "unit": "t/m"
      },
      "density": {
        "value": 0.6732709601792118,
        "unit": "t/m3"
      },
      "tank_height": {
        "value": 12.3,
        "unit": "m"
      }
    }
  }
]
