[
  {
    "rule_id": "TANK_（未知）",
    "description": "延炼液化气罐（未知）参数：volume=1000.0m3；level_max=8.8m；level_min=1.5m；diameter=12.3m；initial_level=5.15m；tank_height=12.3m。",
    "sets": [
      {
        "set_name": "X",
        "subset_name": null,
        "element": "（未知）"
      }
    ],
    "parameters": {
      "volume": {
        "value": 1000.0,
        "unit": "m3"
      },
      "level_max": {
        "value": 8.8,
        "unit": "m"
      },
      "level_min": {
        "value": 1.5,
        "unit": "m"
      },
      "diameter": {
        "value": 12.3,
        "unit": "m"
      },
      "initial_level": {
        "value": 5.15,
        "unit": "m"
      },
      "tank_height": {
        "value": 12.3,
        "unit": "m"
      }
    }
  }
]
